{"schema_version":1,"mission_id":"mission_downgrade01","generated_at":"2026-08-10T12:00:00Z","search_stop_reason":"one downgrade fixture candidate","candidates":[{"candidate_id":"C3","title":"Candidate requiring narrower proof","finding_ids":["F3"],"evidence_grade":"verified","expected_value":"medium","risk":"low","protected_surfaces":[],"proof_available":true,"uncertainty":[],"status":"ranked","ranking_basis":"strong impact with initially overstated proof"}]}
