{"schema_version":1,"mission_id":"mission_notreflected01","generated_at":"2026-08-10T12:00:00Z","search_stop_reason":"one negative downgrade fixture candidate","candidates":[{"candidate_id":"C2","title":"Downgrade omitted from funnel","finding_ids":["F2"],"evidence_grade":"verified","expected_value":"high","risk":"medium","protected_surfaces":[],"proof_available":true,"uncertainty":[],"status":"ranked","ranking_basis":"fixture exercises post-verification grade reflection"}]}
