{"schema_version":1,"mission_id":"mission_fixture01","generated_at":"2026-08-10T12:00:00Z","search_stop_reason":"one strong bounded candidate","candidates":[{"candidate_id":"C1","title":"Dashboard empty state","finding_ids":["F1"],"evidence_grade":"strong","expected_value":"high","risk":"low","protected_surfaces":[],"proof_available":true,"uncertainty":[],"status":"ranked","ranking_basis":"visible defect with focused regression proof"}]}
